{"atlas_fit":{"affected_components":["Operation Ciel","Operation Harmony","Project Odyssey","Aegis"],"current_problem":"Atlas needs reusable safety patterns for privileged operational assistants without exposing secrets to model context.","future_risk":"Direct autonomous server command execution could bypass protected-action and runtime authority boundaries.","recommendation":"ABSORB_CANDIDATE"},"claims":[{"claim":"The repository documents a local-first DevOps agent with secret placeholders, OS keychain storage, approval-by-default, command filters, and pre-change backups.","evidence_refs":["https://github.com/codor-dev/codor/blob/76ede9117863869f8572189f1b33dba39a0ecbf3/README.md","https://github.com/codor-dev/codor/blob/76ede9117863869f8572189f1b33dba39a0ecbf3/LICENSE"],"status":"VERIFIED"},{"claim":"The documented security controls prevent all secret leakage or destructive execution in real deployments.","evidence_refs":["https://github.com/codor-dev/codor/blob/76ede9117863869f8572189f1b33dba39a0ecbf3/README.md","https://github.com/codor-dev/codor/blob/76ede9117863869f8572189f1b33dba39a0ecbf3/LICENSE"],"status":"UNPROVEN"}],"observed_at":"2026-07-25T06:49:03Z","protected_boundary":{"classification":"PUBLIC_CLEAN","excluded_classes":["secrets","credentials","private keys","MFA or recovery codes","PHI","raw financial, legal, tax, insurance, mortgage, estate, brokerage, or account evidence","private network values","raw exports","personal chat archives","unredacted logs","executable payloads","source-heavy copyrighted material"]},"record_id":"HARVEST-CODOR-R01","schema_version":"atlas.ciel.harvest-record.v1","source":{"kind":"REPOSITORY","license_status":"VERIFIED","locator":"https://github.com/codor-dev/codor","retrieved_at":"2026-07-25T06:49:03Z","revision":"76ede9117863869f8572189f1b33dba39a0ecbf3"},"source_class":"PUBLIC_CLEAN","status":"REVIEWED","title":"Codor","verification":{"evidence_refs":["https://github.com/codor-dev/codor/blob/76ede9117863869f8572189f1b33dba39a0ecbf3/README.md","https://github.com/codor-dev/codor/blob/76ede9117863869f8572189f1b33dba39a0ecbf3/LICENSE"],"state":"PARTIAL","unresolved":["Runtime behavior, security effectiveness, performance, and compatibility were not independently executed or benchmarked in this Mission."]}}
