{"atlas_fit":{"affected_components":["Document Pipeline","Cloud Atlas","Operation Ciel"],"current_problem":"Atlas needs flexible local OCR options for images and PDFs without sending protected documents to cloud services.","future_risk":"Vision-language OCR can hallucinate text, mishandle complex layouts, and expose documents through misconfigured model endpoints.","recommendation":"ABSORB_CANDIDATE"},"claims":[{"claim":"The repository documents a Python and Streamlit OCR package using Ollama vision models for image and PDF extraction with several output formats and batch processing.","evidence_refs":["https://github.com/imanoop7/Ollama-OCR/blob/389d220bf516bb4b3e76193edcfee163a54c4036/README.md","https://github.com/imanoop7/Ollama-OCR/blob/389d220bf516bb4b3e76193edcfee163a54c4036/LICENSE"],"status":"VERIFIED"},{"claim":"The selected vision models provide accurate OCR for every document type.","evidence_refs":["https://github.com/imanoop7/Ollama-OCR/blob/389d220bf516bb4b3e76193edcfee163a54c4036/README.md","https://github.com/imanoop7/Ollama-OCR/blob/389d220bf516bb4b3e76193edcfee163a54c4036/LICENSE"],"status":"UNPROVEN"}],"observed_at":"2026-07-25T06:49:03Z","protected_boundary":{"classification":"PUBLIC_CLEAN","excluded_classes":["secrets","credentials","private keys","MFA or recovery codes","PHI","raw financial, legal, tax, insurance, mortgage, estate, brokerage, or account evidence","private network values","raw exports","personal chat archives","unredacted logs","executable payloads","source-heavy copyrighted material"]},"record_id":"HARVEST-OLLAMA-OCR-R01","schema_version":"atlas.ciel.harvest-record.v1","source":{"kind":"REPOSITORY","license_status":"VERIFIED","locator":"https://github.com/imanoop7/Ollama-OCR","retrieved_at":"2026-07-25T06:49:03Z","revision":"389d220bf516bb4b3e76193edcfee163a54c4036"},"source_class":"PUBLIC_CLEAN","status":"REVIEWED","title":"Ollama-OCR","verification":{"evidence_refs":["https://github.com/imanoop7/Ollama-OCR/blob/389d220bf516bb4b3e76193edcfee163a54c4036/README.md","https://github.com/imanoop7/Ollama-OCR/blob/389d220bf516bb4b3e76193edcfee163a54c4036/LICENSE"],"state":"PARTIAL","unresolved":["Runtime behavior, security effectiveness, performance, and compatibility were not independently executed or benchmarked in this Mission."]}}
