{"atlas_fit":{"affected_components":["Operation Harmony","Thread Engine","Glass Codex","Source Governance"],"current_problem":"Atlas needs understandable orchestration views and typed workflow components without creating a second authority system.","future_risk":"A visual workflow platform could duplicate Thread Engine, hide execution authority, or introduce source-available licensing constraints.","recommendation":"ABSORB_CANDIDATE"},"claims":[{"claim":"The repository documents a self-hostable visual directed-graph platform for AI agents and automations with multi-provider, RAG, observability, and node extension features.","evidence_refs":["https://github.com/nmamizerov/assemblix/blob/ff90f8ba127d01193ec764dccbbdf6a949926727/README.md","https://github.com/nmamizerov/assemblix/blob/ff90f8ba127d01193ec764dccbbdf6a949926727/LICENSE.md"],"status":"VERIFIED"},{"claim":"Its production and security claims are sufficient for Atlas deployment without independent review.","evidence_refs":["https://github.com/nmamizerov/assemblix/blob/ff90f8ba127d01193ec764dccbbdf6a949926727/README.md","https://github.com/nmamizerov/assemblix/blob/ff90f8ba127d01193ec764dccbbdf6a949926727/LICENSE.md"],"status":"UNPROVEN"}],"observed_at":"2026-07-25T06:49:03Z","protected_boundary":{"classification":"PUBLIC_CLEAN","excluded_classes":["secrets","credentials","private keys","MFA or recovery codes","PHI","raw financial, legal, tax, insurance, mortgage, estate, brokerage, or account evidence","private network values","raw exports","personal chat archives","unredacted logs","executable payloads","source-heavy copyrighted material"]},"record_id":"HARVEST-ASSEMBLIX-R01","schema_version":"atlas.ciel.harvest-record.v1","source":{"kind":"REPOSITORY","license_status":"VERIFIED","locator":"https://github.com/nmamizerov/assemblix","retrieved_at":"2026-07-25T06:49:03Z","revision":"ff90f8ba127d01193ec764dccbbdf6a949926727"},"source_class":"PUBLIC_CLEAN","status":"REVIEWED","title":"Assemblix","verification":{"evidence_refs":["https://github.com/nmamizerov/assemblix/blob/ff90f8ba127d01193ec764dccbbdf6a949926727/README.md","https://github.com/nmamizerov/assemblix/blob/ff90f8ba127d01193ec764dccbbdf6a949926727/LICENSE.md"],"state":"PARTIAL","unresolved":["Runtime behavior, security effectiveness, performance, and compatibility were not independently executed or benchmarked in this Mission."]}}
