{"atlas_fit":{"affected_components":["Beacon / Home Assistant Core","Operation Ciel","Cloud Atlas"],"current_problem":"Beacon needs deep Home Assistant observability for troubleshooting without granting an AI control authority.","future_risk":"Read access still exposes household occupancy, devices, logs, tokens, configurations, and private network details.","recommendation":"ABSORB_CANDIDATE"},"claims":[{"claim":"The repository documents a read-only Home Assistant MCP server and static context generator covering states, automations, devices, logs, diagnostics, and configuration.","evidence_refs":["https://github.com/paulomac1000/ha-mcp-readonly/blob/7dedea27fbaa328a0a5b5cd5662f1588dcc45310/README.md","https://github.com/paulomac1000/ha-mcp-readonly/blob/7dedea27fbaa328a0a5b5cd5662f1588dcc45310/LICENSE"],"status":"VERIFIED"},{"claim":"Read-only API design makes unrestricted Home Assistant data safe for public Prime or external providers.","evidence_refs":["https://github.com/paulomac1000/ha-mcp-readonly/blob/7dedea27fbaa328a0a5b5cd5662f1588dcc45310/README.md","https://github.com/paulomac1000/ha-mcp-readonly/blob/7dedea27fbaa328a0a5b5cd5662f1588dcc45310/LICENSE"],"status":"REJECTED"}],"observed_at":"2026-07-25T06:49:03Z","protected_boundary":{"classification":"PUBLIC_CLEAN","excluded_classes":["secrets","credentials","private keys","MFA or recovery codes","PHI","raw financial, legal, tax, insurance, mortgage, estate, brokerage, or account evidence","private network values","raw exports","personal chat archives","unredacted logs","executable payloads","source-heavy copyrighted material"]},"record_id":"HARVEST-HA-MCP-READONLY-R01","schema_version":"atlas.ciel.harvest-record.v1","source":{"kind":"REPOSITORY","license_status":"VERIFIED","locator":"https://github.com/paulomac1000/ha-mcp-readonly","retrieved_at":"2026-07-25T06:49:03Z","revision":"7dedea27fbaa328a0a5b5cd5662f1588dcc45310"},"source_class":"PUBLIC_CLEAN","status":"REVIEWED","title":"HA-MCP-Readonly","verification":{"evidence_refs":["https://github.com/paulomac1000/ha-mcp-readonly/blob/7dedea27fbaa328a0a5b5cd5662f1588dcc45310/README.md","https://github.com/paulomac1000/ha-mcp-readonly/blob/7dedea27fbaa328a0a5b5cd5662f1588dcc45310/LICENSE"],"state":"PARTIAL","unresolved":["Runtime behavior, security effectiveness, performance, and compatibility were not independently executed or benchmarked in this Mission."]}}
