{"atlas_fit":{"affected_components":["Athena","Aegis","Mission Control","Repository Process"],"current_problem":"Atlas needs bounded continuation for long tasks while retaining explicit authority, checkpoints, and stop conditions.","future_risk":"Autopilot with broad permissions can alter or delete files and consume resources without intermediate review.","recommendation":"ABSORB_CANDIDATE"},"claims":[{"claim":"GitHub documents Copilot CLI autopilot as multi-step autonomous continuation until completion, interruption, failure, or a configured continuation limit.","evidence_refs":["https://docs.github.com/en/copilot/concepts/agents/copilot-cli/autopilot","https://docs.github.com/en/copilot/reference/copilot-cli-reference/cli-command-reference","https://docs.github.com/en/copilot/how-tos/copilot-cli/use-copilot-cli/delegate-tasks-to-cca"],"status":"VERIFIED"},{"claim":"Autopilot is safe for vague or protected Atlas work when full permissions are granted.","evidence_refs":["https://docs.github.com/en/copilot/concepts/agents/copilot-cli/autopilot","https://docs.github.com/en/copilot/reference/copilot-cli-reference/cli-command-reference","https://docs.github.com/en/copilot/how-tos/copilot-cli/use-copilot-cli/delegate-tasks-to-cca"],"status":"REJECTED"}],"observed_at":"2026-07-25T06:49:03Z","protected_boundary":{"classification":"PUBLIC_CLEAN","excluded_classes":["secrets","credentials","private keys","MFA or recovery codes","PHI","raw financial, legal, tax, insurance, mortgage, estate, brokerage, or account evidence","private network values","raw exports","personal chat archives","unredacted logs","executable payloads","source-heavy copyrighted material"]},"record_id":"HARVEST-GITHUB-AUTOPILOT-R01","schema_version":"atlas.ciel.harvest-record.v1","source":{"kind":"WORKFLOW","license_status":"NOT_APPLICABLE","locator":"mission://CIEL-C01-M02/source-set/github-autopilot","retrieved_at":"2026-07-25T06:49:03Z","revision":"9a6e8b558fb3ee7814becdd09869d50f6cf17d44a452f6d8d66cf191e650c5f5"},"source_class":"PUBLIC_CLEAN","status":"REVIEWED","title":"GitHub Copilot CLI Autopilot","verification":{"evidence_refs":["https://docs.github.com/en/copilot/concepts/agents/copilot-cli/autopilot","https://docs.github.com/en/copilot/reference/copilot-cli-reference/cli-command-reference","https://docs.github.com/en/copilot/how-tos/copilot-cli/use-copilot-cli/delegate-tasks-to-cca"],"state":"PARTIAL","unresolved":["Runtime behavior, security effectiveness, performance, and compatibility were not independently executed or benchmarked in this Mission.","Composite source-set claims depend on the cited official pages and require re-Harvest when those pages or terms change."]}}
