{"atlas_fit":{"affected_components":["Operation Harmony","Cloud Atlas","AI Governance","Aegis"],"current_problem":"Atlas provider routing must account for product tier, training defaults, retention, logging, location, and protected-data class—not price alone.","future_risk":"The word free, local, API, business, or zero retention may be treated as a universal privacy guarantee.","recommendation":"ABSORB_CANDIDATE"},"claims":[{"claim":"Official provider policies distinguish consumer and commercial data use, opt-in training, retention, logging, and zero-data-retention conditions.","evidence_refs":["https://platform.openai.com/docs/models/default-usage-policies-by-endpoint","https://privacy.anthropic.com/en/articles/7996868-is-my-data-used-for-model-training","https://ai.google.dev/gemini-api/docs/zdr","https://docs.github.com/en/copilot/reference/ai-models/model-hosting"],"status":"VERIFIED"},{"claim":"Any provider or plan is universally safe for protected Atlas data.","evidence_refs":["https://platform.openai.com/docs/models/default-usage-policies-by-endpoint","https://privacy.anthropic.com/en/articles/7996868-is-my-data-used-for-model-training","https://ai.google.dev/gemini-api/docs/zdr","https://docs.github.com/en/copilot/reference/ai-models/model-hosting"],"status":"REJECTED"}],"observed_at":"2026-07-25T06:49:03Z","protected_boundary":{"classification":"PUBLIC_CLEAN","excluded_classes":["secrets","credentials","private keys","MFA or recovery codes","PHI","raw financial, legal, tax, insurance, mortgage, estate, brokerage, or account evidence","private network values","raw exports","personal chat archives","unredacted logs","executable payloads","source-heavy copyrighted material"]},"record_id":"HARVEST-FREE-LLM-PRIVACY-PROVIDER-ROUTING-R01","schema_version":"atlas.ciel.harvest-record.v1","source":{"kind":"OTHER","license_status":"NOT_APPLICABLE","locator":"mission://CIEL-C01-M02/source-set/free-llm-privacy-provider-routing","retrieved_at":"2026-07-25T06:49:03Z","revision":"17b86fba87aeb3ad35536450d43a0c47f6704502889a0b348cfa145ceb45a35c"},"source_class":"PUBLIC_CLEAN","status":"REVIEWED","title":"Provider Privacy and Routing Evidence","verification":{"evidence_refs":["https://platform.openai.com/docs/models/default-usage-policies-by-endpoint","https://privacy.anthropic.com/en/articles/7996868-is-my-data-used-for-model-training","https://ai.google.dev/gemini-api/docs/zdr","https://docs.github.com/en/copilot/reference/ai-models/model-hosting"],"state":"PARTIAL","unresolved":["Runtime behavior, security effectiveness, performance, and compatibility were not independently executed or benchmarked in this Mission.","Composite source-set claims depend on the cited official pages and require re-Harvest when those pages or terms change."]}}
