{"atlas_fit":{"affected_components":["Cloud Atlas","Operation Coppermind","Operation Ciel"],"current_problem":"Atlas may benefit from local activity retrieval while keeping personal browsing history outside public-clean source.","future_risk":"Browser history contains sensitive personal, medical, financial, authentication, and private-network information.","recommendation":"ABSORB_CANDIDATE"},"claims":[{"claim":"The repository documents a local-first MCP and HTTP interface for browser history, bookmarks, and downloads, including URL sanitization.","evidence_refs":["https://github.com/nikolasil/chronicle-mcp/blob/a296f305fd1443998911f923789d9bc13c89a6c1/README.md","https://github.com/nikolasil/chronicle-mcp/blob/a296f305fd1443998911f923789d9bc13c89a6c1/LICENSE"],"status":"VERIFIED"},{"claim":"Sanitizing selected query parameters makes browser history safe for Prime or unrestricted agents.","evidence_refs":["https://github.com/nikolasil/chronicle-mcp/blob/a296f305fd1443998911f923789d9bc13c89a6c1/README.md","https://github.com/nikolasil/chronicle-mcp/blob/a296f305fd1443998911f923789d9bc13c89a6c1/LICENSE"],"status":"REJECTED"}],"observed_at":"2026-07-25T06:49:03Z","protected_boundary":{"classification":"PUBLIC_CLEAN","excluded_classes":["secrets","credentials","private keys","MFA or recovery codes","PHI","raw financial, legal, tax, insurance, mortgage, estate, brokerage, or account evidence","private network values","raw exports","personal chat archives","unredacted logs","executable payloads","source-heavy copyrighted material"]},"record_id":"HARVEST-CHRONICLE-MCP-R01","schema_version":"atlas.ciel.harvest-record.v1","source":{"kind":"REPOSITORY","license_status":"VERIFIED","locator":"https://github.com/nikolasil/chronicle-mcp","retrieved_at":"2026-07-25T06:49:03Z","revision":"a296f305fd1443998911f923789d9bc13c89a6c1"},"source_class":"PUBLIC_CLEAN","status":"REVIEWED","title":"Chronicle MCP","verification":{"evidence_refs":["https://github.com/nikolasil/chronicle-mcp/blob/a296f305fd1443998911f923789d9bc13c89a6c1/README.md","https://github.com/nikolasil/chronicle-mcp/blob/a296f305fd1443998911f923789d9bc13c89a6c1/LICENSE"],"state":"PARTIAL","unresolved":["Runtime behavior, security effectiveness, performance, and compatibility were not independently executed or benchmarked in this Mission."]}}
