{"atlas_fit":{"affected_components":["Prometheus Foundation","Project Odyssey","Operation Harmony"],"current_problem":"Prometheus accelerator planning needs official hardware-fit evidence before purchase, installation, or passthrough decisions.","future_risk":"Specification compatibility does not prove enclosure fit, power, thermals, drivers, virtualization, or model performance.","recommendation":"PRESERVE_ONLY"},"claims":[{"claim":"Intel documents the Arc Pro B50 as a 16 GB GDDR6, 70 W, PCIe 5.0 x8 workstation GPU with Xe2, XMX, media engines, oneAPI, OpenVINO, and IPEX support.","evidence_refs":["https://www.intel.com/content/www/us/en/products/sku/242615/intel-arc-pro-b50-graphics/specifications.html","https://www.intel.com/content/www/us/en/products/docs/discrete-gpus/arc/workstations/b-series/overview.html","https://store.minisforum.com/products/minisforum-ms-02-ultra-workstation"],"status":"VERIFIED"},{"claim":"MINISFORUM documents the MS-02 Ultra with a PCIe 5.0 x16 expansion slot and dual-slot GPU support.","evidence_refs":["https://www.intel.com/content/www/us/en/products/sku/242615/intel-arc-pro-b50-graphics/specifications.html","https://www.intel.com/content/www/us/en/products/docs/discrete-gpus/arc/workstations/b-series/overview.html","https://store.minisforum.com/products/minisforum-ms-02-ultra-workstation"],"status":"VERIFIED"},{"claim":"The B50 is proven compatible, stable, and performant in Jayson's exact MS-02 configuration.","evidence_refs":["https://www.intel.com/content/www/us/en/products/sku/242615/intel-arc-pro-b50-graphics/specifications.html","https://www.intel.com/content/www/us/en/products/docs/discrete-gpus/arc/workstations/b-series/overview.html","https://store.minisforum.com/products/minisforum-ms-02-ultra-workstation"],"status":"UNPROVEN"}],"observed_at":"2026-07-25T06:49:03Z","protected_boundary":{"classification":"PUBLIC_CLEAN","excluded_classes":["secrets","credentials","private keys","MFA or recovery codes","PHI","raw financial, legal, tax, insurance, mortgage, estate, brokerage, or account evidence","private network values","raw exports","personal chat archives","unredacted logs","executable payloads","source-heavy copyrighted material"]},"record_id":"HARVEST-INTEL-ARC-PRO-B50-MS02-R01","schema_version":"atlas.ciel.harvest-record.v1","source":{"kind":"OTHER","license_status":"NOT_APPLICABLE","locator":"mission://CIEL-C01-M02/source-set/intel-arc-pro-b50-ms02","retrieved_at":"2026-07-25T06:49:03Z","revision":"8065cd0617a3b8abc066088a33dbfb4f784b02ae24b44f3f89bd06226d1adcc7"},"source_class":"PUBLIC_CLEAN","status":"REVIEWED","title":"Intel Arc Pro B50 and MINISFORUM MS-02 Evidence","verification":{"evidence_refs":["https://www.intel.com/content/www/us/en/products/sku/242615/intel-arc-pro-b50-graphics/specifications.html","https://www.intel.com/content/www/us/en/products/docs/discrete-gpus/arc/workstations/b-series/overview.html","https://store.minisforum.com/products/minisforum-ms-02-ultra-workstation"],"state":"PARTIAL","unresolved":["Runtime behavior, security effectiveness, performance, and compatibility were not independently executed or benchmarked in this Mission.","Composite source-set claims depend on the cited official pages and require re-Harvest when those pages or terms change."]}}
