{"atlas_fit":{"affected_components":["Operation Ciel","Project Arcanum","Source Governance"],"current_problem":"Atlas may benefit from polished public profile and project-presentation patterns.","future_risk":"An unverified registry skill can carry manipulative instructions, bundled files, telemetry, or unclear licensing.","recommendation":"PRESERVE_ONLY"},"claims":[{"claim":"A public skill listing describes generation of GitHub profile READMEs with badges, charts, and contribution visuals.","evidence_refs":["https://aitoolworth.com/openclaw-skills/sa9saq/github-profile-readme","https://github.com/openclaw/clawhub/blob/main/docs/skill-format.md","https://docs.github.com/en/account-and-profile/how-tos/profile-customization/managing-your-profile-readme"],"status":"VERIFIED"},{"claim":"The exact skill package, source revision, and license are independently verified for code reuse.","evidence_refs":["https://aitoolworth.com/openclaw-skills/sa9saq/github-profile-readme","https://github.com/openclaw/clawhub/blob/main/docs/skill-format.md","https://docs.github.com/en/account-and-profile/how-tos/profile-customization/managing-your-profile-readme"],"status":"UNPROVEN"}],"observed_at":"2026-07-25T06:49:03Z","protected_boundary":{"classification":"PUBLIC_CLEAN","excluded_classes":["secrets","credentials","private keys","MFA or recovery codes","PHI","raw financial, legal, tax, insurance, mortgage, estate, brokerage, or account evidence","private network values","raw exports","personal chat archives","unredacted logs","executable payloads","source-heavy copyrighted material"]},"record_id":"HARVEST-GITHUB-PROFILE-README-SKILL-R01","schema_version":"atlas.ciel.harvest-record.v1","source":{"kind":"WORKFLOW","license_status":"NOT_APPLICABLE","locator":"mission://CIEL-C01-M02/source-set/github-profile-readme-skill","retrieved_at":"2026-07-25T06:49:03Z","revision":"2c1f5d442fb87de55d4ad620aa4edd1a557e925bd3ff640a74572d7ccbe500ff"},"source_class":"PUBLIC_CLEAN","status":"REVIEWED","title":"GitHub Profile README Skill","verification":{"evidence_refs":["https://aitoolworth.com/openclaw-skills/sa9saq/github-profile-readme","https://github.com/openclaw/clawhub/blob/main/docs/skill-format.md","https://docs.github.com/en/account-and-profile/how-tos/profile-customization/managing-your-profile-readme"],"state":"PARTIAL","unresolved":["Runtime behavior, security effectiveness, performance, and compatibility were not independently executed or benchmarked in this Mission.","Composite source-set claims depend on the cited official pages and require re-Harvest when those pages or terms change."]}}
