{"atlas_fit":{"affected_components":["Document Pipeline","Operation Coppermind","Glass Codex"],"current_problem":"Text-only retrieval loses charts, tables, layout, and other visual evidence.","future_risk":"Screenshot indexes are storage-intensive, can contain protected visual data, and may retrieve appearance without semantic correctness.","recommendation":"ABSORB_CANDIDATE"},"claims":[{"claim":"The repository documents rendering documents into screenshot tiles and retrieving over images to preserve visual structure, with an Apache-2.0 codebase and research paper.","evidence_refs":["https://github.com/StarTrail-org/PixelRAG/blob/1a9ba756204e01d38cbdd9380bd81887ddaebfca/README.md","https://github.com/StarTrail-org/PixelRAG/blob/1a9ba756204e01d38cbdd9380bd81887ddaebfca/LICENSE"],"status":"VERIFIED"},{"claim":"Hosted-index benchmarks and visual retrieval quality generalize to Atlas documents and privacy needs.","evidence_refs":["https://github.com/StarTrail-org/PixelRAG/blob/1a9ba756204e01d38cbdd9380bd81887ddaebfca/README.md","https://github.com/StarTrail-org/PixelRAG/blob/1a9ba756204e01d38cbdd9380bd81887ddaebfca/LICENSE"],"status":"UNPROVEN"}],"observed_at":"2026-07-25T06:49:03Z","protected_boundary":{"classification":"PUBLIC_CLEAN","excluded_classes":["secrets","credentials","private keys","MFA or recovery codes","PHI","raw financial, legal, tax, insurance, mortgage, estate, brokerage, or account evidence","private network values","raw exports","personal chat archives","unredacted logs","executable payloads","source-heavy copyrighted material"]},"record_id":"HARVEST-PIXELRAG-R01","schema_version":"atlas.ciel.harvest-record.v1","source":{"kind":"REPOSITORY","license_status":"VERIFIED","locator":"https://github.com/StarTrail-org/PixelRAG","retrieved_at":"2026-07-25T06:49:03Z","revision":"1a9ba756204e01d38cbdd9380bd81887ddaebfca"},"source_class":"PUBLIC_CLEAN","status":"REVIEWED","title":"PixelRAG","verification":{"evidence_refs":["https://github.com/StarTrail-org/PixelRAG/blob/1a9ba756204e01d38cbdd9380bd81887ddaebfca/README.md","https://github.com/StarTrail-org/PixelRAG/blob/1a9ba756204e01d38cbdd9380bd81887ddaebfca/LICENSE"],"state":"PARTIAL","unresolved":["Runtime behavior, security effectiveness, performance, and compatibility were not independently executed or benchmarked in this Mission."]}}
