{"atlas_fit":{"affected_components":["Operation Ciel","Document Pipeline","Coppermind"],"current_problem":"Atlas needs provenance-preserving research discovery and exact-source recovery without uncontrolled ingestion.","future_risk":"Automatic PDF download and extraction can import copyrighted, malformed, or prompt-injection content.","recommendation":"ABSORB_CANDIDATE"},"claims":[{"claim":"The repository documents MCP tools for arXiv search, metadata retrieval, recent-paper discovery, PDF fetching, and full-text extraction.","evidence_refs":["https://github.com/YounesBensafia/arxiv-reader-mcp/blob/0ec6e94faf9df7327dc9de525e43f49b94ac8c63/README.md","https://github.com/YounesBensafia/arxiv-reader-mcp/blob/0ec6e94faf9df7327dc9de525e43f49b94ac8c63/LICENSE"],"status":"VERIFIED"},{"claim":"Fetched paper text is safe, complete, and legally reusable without source-specific review.","evidence_refs":["https://github.com/YounesBensafia/arxiv-reader-mcp/blob/0ec6e94faf9df7327dc9de525e43f49b94ac8c63/README.md","https://github.com/YounesBensafia/arxiv-reader-mcp/blob/0ec6e94faf9df7327dc9de525e43f49b94ac8c63/LICENSE"],"status":"REJECTED"}],"observed_at":"2026-07-25T06:49:03Z","protected_boundary":{"classification":"PUBLIC_CLEAN","excluded_classes":["secrets","credentials","private keys","MFA or recovery codes","PHI","raw financial, legal, tax, insurance, mortgage, estate, brokerage, or account evidence","private network values","raw exports","personal chat archives","unredacted logs","executable payloads","source-heavy copyrighted material"]},"record_id":"HARVEST-ARXIV-READER-MCP-R01","schema_version":"atlas.ciel.harvest-record.v1","source":{"kind":"REPOSITORY","license_status":"VERIFIED","locator":"https://github.com/YounesBensafia/arxiv-reader-mcp","retrieved_at":"2026-07-25T06:49:03Z","revision":"0ec6e94faf9df7327dc9de525e43f49b94ac8c63"},"source_class":"PUBLIC_CLEAN","status":"REVIEWED","title":"arXiv Reader MCP","verification":{"evidence_refs":["https://github.com/YounesBensafia/arxiv-reader-mcp/blob/0ec6e94faf9df7327dc9de525e43f49b94ac8c63/README.md","https://github.com/YounesBensafia/arxiv-reader-mcp/blob/0ec6e94faf9df7327dc9de525e43f49b94ac8c63/LICENSE"],"state":"PARTIAL","unresolved":["Runtime behavior, security effectiveness, performance, and compatibility were not independently executed or benchmarked in this Mission."]}}
