{"atlas_fit":{"affected_components":["Cloud Atlas","Operation Harmony","Document Pipeline"],"current_problem":"Cloud Atlas may need private meeting capture and summarization patterns without sending recordings to cloud services.","future_risk":"Meeting capture creates consent, legal, PHI, employment, and highly sensitive conversational-data risks.","recommendation":"PRESERVE_ONLY"},"claims":[{"claim":"The repository documents a local privacy-first meeting assistant for capture, transcription, and summarization with MIT-licensed community code.","evidence_refs":["https://github.com/Zackriya-Solutions/meetily/blob/0281737d87d26352fb0adc78c8c0975f691b23d1/README.md","https://github.com/Zackriya-Solutions/meetily/blob/0281737d87d26352fb0adc78c8c0975f691b23d1/LICENSE.md"],"status":"VERIFIED"},{"claim":"Local processing alone resolves consent, legal, retention, and access-control requirements.","evidence_refs":["https://github.com/Zackriya-Solutions/meetily/blob/0281737d87d26352fb0adc78c8c0975f691b23d1/README.md","https://github.com/Zackriya-Solutions/meetily/blob/0281737d87d26352fb0adc78c8c0975f691b23d1/LICENSE.md"],"status":"REJECTED"}],"observed_at":"2026-07-25T06:49:03Z","protected_boundary":{"classification":"PUBLIC_CLEAN","excluded_classes":["secrets","credentials","private keys","MFA or recovery codes","PHI","raw financial, legal, tax, insurance, mortgage, estate, brokerage, or account evidence","private network values","raw exports","personal chat archives","unredacted logs","executable payloads","source-heavy copyrighted material"]},"record_id":"HARVEST-MEETILY-R01","schema_version":"atlas.ciel.harvest-record.v1","source":{"kind":"REPOSITORY","license_status":"VERIFIED","locator":"https://github.com/Zackriya-Solutions/meetily","retrieved_at":"2026-07-25T06:49:03Z","revision":"0281737d87d26352fb0adc78c8c0975f691b23d1"},"source_class":"PUBLIC_CLEAN","status":"REVIEWED","title":"Meetily","verification":{"evidence_refs":["https://github.com/Zackriya-Solutions/meetily/blob/0281737d87d26352fb0adc78c8c0975f691b23d1/README.md","https://github.com/Zackriya-Solutions/meetily/blob/0281737d87d26352fb0adc78c8c0975f691b23d1/LICENSE.md"],"state":"PARTIAL","unresolved":["Runtime behavior, security effectiveness, performance, and compatibility were not independently executed or benchmarked in this Mission."]}}
