{"atlas_fit":{"affected_components":["Operation Ciel","AI Governance","Noctua","Ares"],"current_problem":"Atlas needs reproducible, evidence-first agent workflows that distinguish trusted reproduction from exploratory modification.","future_risk":"Research agents may chase scores, silently change semantics, or mix exploratory artifacts with accepted evidence.","recommendation":"ABSORB_CANDIDATE"},"claims":[{"claim":"The repository documents trusted and exploration lanes, reproducibility outputs, auditable changes, and explicit authorization before candidate exploration.","evidence_refs":["https://github.com/lllllllama/rigorpilot-skills/blob/56bc41c40beabc42f5628f06bb2634a5196071f5/README.md","https://github.com/lllllllama/rigorpilot-skills/blob/56bc41c40beabc42f5628f06bb2634a5196071f5/LICENSE"],"status":"VERIFIED"},{"claim":"Its skills have been independently proven across all Atlas environments.","evidence_refs":["https://github.com/lllllllama/rigorpilot-skills/blob/56bc41c40beabc42f5628f06bb2634a5196071f5/README.md","https://github.com/lllllllama/rigorpilot-skills/blob/56bc41c40beabc42f5628f06bb2634a5196071f5/LICENSE"],"status":"UNPROVEN"}],"observed_at":"2026-07-25T06:49:03Z","protected_boundary":{"classification":"PUBLIC_CLEAN","excluded_classes":["secrets","credentials","private keys","MFA or recovery codes","PHI","raw financial, legal, tax, insurance, mortgage, estate, brokerage, or account evidence","private network values","raw exports","personal chat archives","unredacted logs","executable payloads","source-heavy copyrighted material"]},"record_id":"HARVEST-AGENT-RIGOR-R01","schema_version":"atlas.ciel.harvest-record.v1","source":{"kind":"REPOSITORY","license_status":"VERIFIED","locator":"https://github.com/lllllllama/rigorpilot-skills","retrieved_at":"2026-07-25T06:49:03Z","revision":"56bc41c40beabc42f5628f06bb2634a5196071f5"},"source_class":"PUBLIC_CLEAN","status":"REVIEWED","title":"Agent Rigor / RigorPilot Skills","verification":{"evidence_refs":["https://github.com/lllllllama/rigorpilot-skills/blob/56bc41c40beabc42f5628f06bb2634a5196071f5/README.md","https://github.com/lllllllama/rigorpilot-skills/blob/56bc41c40beabc42f5628f06bb2634a5196071f5/LICENSE"],"state":"PARTIAL","unresolved":["Runtime behavior, security effectiveness, performance, and compatibility were not independently executed or benchmarked in this Mission."]}}
