{"atlas_fit":{"affected_components":["Document Pipeline","Project Odyssey","Cloud Atlas"],"current_problem":"Atlas may need a lightweight local OCR appliance using existing Apple hardware.","future_risk":"A LAN OCR endpoint can expose documents or become continuously available without authentication, freshness, or lifecycle controls.","recommendation":"PRESERVE_ONLY"},"claims":[{"claim":"The repository documents an iPhone OCR server using Apple's Vision framework with local API access and bounding-box output.","evidence_refs":["https://github.com/riddleling/iOS-OCR-Server/blob/b1a79c40d42f773d98abf780d2660306ece24c18/README.md","https://github.com/riddleling/iOS-OCR-Server/blob/b1a79c40d42f773d98abf780d2660306ece24c18/LICENSE"],"status":"VERIFIED"},{"claim":"Running the app continuously with its screen on is an operationally reliable or secure Atlas service.","evidence_refs":["https://github.com/riddleling/iOS-OCR-Server/blob/b1a79c40d42f773d98abf780d2660306ece24c18/README.md","https://github.com/riddleling/iOS-OCR-Server/blob/b1a79c40d42f773d98abf780d2660306ece24c18/LICENSE"],"status":"UNPROVEN"}],"observed_at":"2026-07-25T06:49:03Z","protected_boundary":{"classification":"PUBLIC_CLEAN","excluded_classes":["secrets","credentials","private keys","MFA or recovery codes","PHI","raw financial, legal, tax, insurance, mortgage, estate, brokerage, or account evidence","private network values","raw exports","personal chat archives","unredacted logs","executable payloads","source-heavy copyrighted material"]},"record_id":"HARVEST-IOS-OCR-SERVER-R01","schema_version":"atlas.ciel.harvest-record.v1","source":{"kind":"REPOSITORY","license_status":"VERIFIED","locator":"https://github.com/riddleling/iOS-OCR-Server","retrieved_at":"2026-07-25T06:49:03Z","revision":"b1a79c40d42f773d98abf780d2660306ece24c18"},"source_class":"PUBLIC_CLEAN","status":"REVIEWED","title":"iOS OCR Server","verification":{"evidence_refs":["https://github.com/riddleling/iOS-OCR-Server/blob/b1a79c40d42f773d98abf780d2660306ece24c18/README.md","https://github.com/riddleling/iOS-OCR-Server/blob/b1a79c40d42f773d98abf780d2660306ece24c18/LICENSE"],"state":"PARTIAL","unresolved":["Runtime behavior, security effectiveness, performance, and compatibility were not independently executed or benchmarked in this Mission."]}}
