{"atlas_fit":{"affected_components":["Glass Codex","Operation Harmony","Cloud Atlas"],"current_problem":"Atlas needs inspiration for an integrated private AI workspace without collapsing service, data, and authority boundaries.","future_risk":"A monolithic self-hosted workspace can combine chat, shell, email, documents, credentials, and agents into one high-impact compromise domain.","recommendation":"PRESERVE_ONLY"},"claims":[{"claim":"The repository documents a self-hosted workspace spanning chat, agents, research, documents, email, notes, tasks, calendar, local models, MCP, and tools.","evidence_refs":["https://github.com/odysseus-dev/odysseus/blob/d8a2059df8e53bc7275c45339849d14c8651e73c/README.md","https://github.com/odysseus-dev/odysseus/blob/d8a2059df8e53bc7275c45339849d14c8651e73c/LICENSE"],"status":"VERIFIED"},{"claim":"Its broad integration is safe or compatible with Atlas without dedicated threat modeling and AGPL review.","evidence_refs":["https://github.com/odysseus-dev/odysseus/blob/d8a2059df8e53bc7275c45339849d14c8651e73c/README.md","https://github.com/odysseus-dev/odysseus/blob/d8a2059df8e53bc7275c45339849d14c8651e73c/LICENSE"],"status":"UNPROVEN"}],"observed_at":"2026-07-25T06:49:03Z","protected_boundary":{"classification":"PUBLIC_CLEAN","excluded_classes":["secrets","credentials","private keys","MFA or recovery codes","PHI","raw financial, legal, tax, insurance, mortgage, estate, brokerage, or account evidence","private network values","raw exports","personal chat archives","unredacted logs","executable payloads","source-heavy copyrighted material"]},"record_id":"HARVEST-ODYSSEUS-R01","schema_version":"atlas.ciel.harvest-record.v1","source":{"kind":"REPOSITORY","license_status":"VERIFIED","locator":"https://github.com/odysseus-dev/odysseus","retrieved_at":"2026-07-25T06:49:03Z","revision":"d8a2059df8e53bc7275c45339849d14c8651e73c"},"source_class":"PUBLIC_CLEAN","status":"REVIEWED","title":"Odysseus","verification":{"evidence_refs":["https://github.com/odysseus-dev/odysseus/blob/d8a2059df8e53bc7275c45339849d14c8651e73c/README.md","https://github.com/odysseus-dev/odysseus/blob/d8a2059df8e53bc7275c45339849d14c8651e73c/LICENSE"],"state":"PARTIAL","unresolved":["Runtime behavior, security effectiveness, performance, and compatibility were not independently executed or benchmarked in this Mission."]}}
