{"atlas_fit":{"affected_components":["Operation Harmony","Prometheus Foundation","AI Governance"],"current_problem":"Atlas needs current local coding-model candidates evaluated against its own governed workflows rather than headline benchmarks.","future_risk":"Model-card benchmark claims, large resource needs, and agentic coding behavior may be mistaken for safe deployment readiness.","recommendation":"ABSORB_CANDIDATE"},"claims":[{"claim":"DeepReinforce publishes an MIT-licensed Ornith 1.0 family specialized for agentic coding, including 9B and 35B variants and GGUF packaging.","evidence_refs":["https://huggingface.co/deepreinforce-ai","https://huggingface.co/deepreinforce-ai/Ornith-1.0-9B","https://huggingface.co/deepreinforce-ai/Ornith-1.0-35B","https://huggingface.co/deepreinforce-ai/Ornith-1.0-35B-GGUF"],"status":"VERIFIED"},{"claim":"Published benchmark results prove the models outperform current Atlas routes on Atlas tasks.","evidence_refs":["https://huggingface.co/deepreinforce-ai","https://huggingface.co/deepreinforce-ai/Ornith-1.0-9B","https://huggingface.co/deepreinforce-ai/Ornith-1.0-35B","https://huggingface.co/deepreinforce-ai/Ornith-1.0-35B-GGUF"],"status":"UNPROVEN"}],"observed_at":"2026-07-25T06:49:03Z","protected_boundary":{"classification":"PUBLIC_CLEAN","excluded_classes":["secrets","credentials","private keys","MFA or recovery codes","PHI","raw financial, legal, tax, insurance, mortgage, estate, brokerage, or account evidence","private network values","raw exports","personal chat archives","unredacted logs","executable payloads","source-heavy copyrighted material"]},"record_id":"HARVEST-ORNITH-R01","schema_version":"atlas.ciel.harvest-record.v1","source":{"kind":"MODEL","license_status":"VERIFIED","locator":"mission://CIEL-C01-M02/source-set/ornith","retrieved_at":"2026-07-25T06:49:03Z","revision":"296f6b1244d89e9a10515f6ba429cdad9cdacb117b118b92880e8a7687010947"},"source_class":"PUBLIC_CLEAN","status":"REVIEWED","title":"Ornith 1.0 Model Family","verification":{"evidence_refs":["https://huggingface.co/deepreinforce-ai","https://huggingface.co/deepreinforce-ai/Ornith-1.0-9B","https://huggingface.co/deepreinforce-ai/Ornith-1.0-35B","https://huggingface.co/deepreinforce-ai/Ornith-1.0-35B-GGUF"],"state":"PARTIAL","unresolved":["Runtime behavior, security effectiveness, performance, and compatibility were not independently executed or benchmarked in this Mission.","Composite source-set claims depend on the cited official pages and require re-Harvest when those pages or terms change."]}}
