{"atlas_fit":{"affected_components":["Project Odyssey","Operation Harmony","Document Pipeline"],"current_problem":"Atlas needs reproducible on-device model packaging and device-compatibility evidence for Apple endpoints.","future_risk":"Converted model catalogs can mix repository, converter, model, and dataset licenses and may overstate device compatibility.","recommendation":"ABSORB_CANDIDATE"},"claims":[{"claim":"The repository documents Core AI model conversions, reproducible recipes, model cards, and device-verification claims for Apple platforms.","evidence_refs":["https://github.com/john-rocky/coreai-model-zoo/blob/1797e08d3779f3eaed48b98ac1055c72914cb453/README.md","https://github.com/john-rocky/coreai-model-zoo/blob/1797e08d3779f3eaed48b98ac1055c72914cb453/LICENSE"],"status":"VERIFIED"},{"claim":"The repository-level BSD license applies uniformly to every converted model and its upstream weights.","evidence_refs":["https://github.com/john-rocky/coreai-model-zoo/blob/1797e08d3779f3eaed48b98ac1055c72914cb453/README.md","https://github.com/john-rocky/coreai-model-zoo/blob/1797e08d3779f3eaed48b98ac1055c72914cb453/LICENSE"],"status":"REJECTED"}],"observed_at":"2026-07-25T06:49:03Z","protected_boundary":{"classification":"PUBLIC_CLEAN","excluded_classes":["secrets","credentials","private keys","MFA or recovery codes","PHI","raw financial, legal, tax, insurance, mortgage, estate, brokerage, or account evidence","private network values","raw exports","personal chat archives","unredacted logs","executable payloads","source-heavy copyrighted material"]},"record_id":"HARVEST-APPLE-CORE-AI-MODELS-R01","schema_version":"atlas.ciel.harvest-record.v1","source":{"kind":"REPOSITORY","license_status":"VERIFIED","locator":"https://github.com/john-rocky/coreai-model-zoo","retrieved_at":"2026-07-25T06:49:03Z","revision":"1797e08d3779f3eaed48b98ac1055c72914cb453"},"source_class":"PUBLIC_CLEAN","status":"REVIEWED","title":"Apple Core AI Model Zoo","verification":{"evidence_refs":["https://github.com/john-rocky/coreai-model-zoo/blob/1797e08d3779f3eaed48b98ac1055c72914cb453/README.md","https://github.com/john-rocky/coreai-model-zoo/blob/1797e08d3779f3eaed48b98ac1055c72914cb453/LICENSE"],"state":"PARTIAL","unresolved":["Runtime behavior, security effectiveness, performance, and compatibility were not independently executed or benchmarked in this Mission."]}}
