{"atlas_fit":{"affected_components":["Operation Coppermind","Document Pipeline","Operation Ciel"],"current_problem":"Atlas needs broad RAG design and failure-mode checklists for future Coppermind and document-retrieval decisions.","future_risk":"Educational taxonomies may be mistaken for validated Atlas architecture or current benchmark evidence.","recommendation":"PRESERVE_ONLY"},"claims":[{"claim":"The repository documents an extensive RAG interview and learning taxonomy covering retrieval, chunking, evaluation, security, graphs, multimodal retrieval, and memory.","evidence_refs":["https://github.com/ather-techie/rag-interview-system/blob/26b883cab7166f89d91db9cb01c6f2ddb4abf36e/README.md","https://github.com/ather-techie/rag-interview-system/blob/26b883cab7166f89d91db9cb01c6f2ddb4abf36e/LICENSE"],"status":"VERIFIED"},{"claim":"The repository's educational claims constitute production acceptance evidence for Atlas.","evidence_refs":["https://github.com/ather-techie/rag-interview-system/blob/26b883cab7166f89d91db9cb01c6f2ddb4abf36e/README.md","https://github.com/ather-techie/rag-interview-system/blob/26b883cab7166f89d91db9cb01c6f2ddb4abf36e/LICENSE"],"status":"REJECTED"}],"observed_at":"2026-07-25T06:49:03Z","protected_boundary":{"classification":"PUBLIC_CLEAN","excluded_classes":["secrets","credentials","private keys","MFA or recovery codes","PHI","raw financial, legal, tax, insurance, mortgage, estate, brokerage, or account evidence","private network values","raw exports","personal chat archives","unredacted logs","executable payloads","source-heavy copyrighted material"]},"record_id":"HARVEST-RAG-INTERVIEW-SYSTEM-R01","schema_version":"atlas.ciel.harvest-record.v1","source":{"kind":"REPOSITORY","license_status":"VERIFIED","locator":"https://github.com/ather-techie/rag-interview-system","retrieved_at":"2026-07-25T06:49:03Z","revision":"26b883cab7166f89d91db9cb01c6f2ddb4abf36e"},"source_class":"PUBLIC_CLEAN","status":"REVIEWED","title":"RAG Interview System","verification":{"evidence_refs":["https://github.com/ather-techie/rag-interview-system/blob/26b883cab7166f89d91db9cb01c6f2ddb4abf36e/README.md","https://github.com/ather-techie/rag-interview-system/blob/26b883cab7166f89d91db9cb01c6f2ddb4abf36e/LICENSE"],"state":"PARTIAL","unresolved":["Runtime behavior, security effectiveness, performance, and compatibility were not independently executed or benchmarked in this Mission."]}}
