{"atlas_fit":{"affected_components":["Document Pipeline","Prometheus Foundation","Operation Ciel"],"current_problem":"Atlas needs high-quality document linearization for complex PDFs with measurable evaluation.","future_risk":"GPU-heavy OCR pipelines and benchmark claims may not match Atlas hardware, documents, or protected-data requirements.","recommendation":"ABSORB_CANDIDATE"},"claims":[{"claim":"The repository documents an Apache-licensed toolkit for converting PDF and image documents to reading-order Markdown, including equations, tables, handwriting, and benchmark tooling.","evidence_refs":["https://github.com/allenai/olmocr/blob/f7cfe4c22098b154c76b6ec950d1c0a464eecf8d/README.md","https://github.com/allenai/olmocr/blob/f7cfe4c22098b154c76b6ec950d1c0a464eecf8d/LICENSE"],"status":"VERIFIED"},{"claim":"Its published benchmark and cost claims predict Atlas performance and accuracy.","evidence_refs":["https://github.com/allenai/olmocr/blob/f7cfe4c22098b154c76b6ec950d1c0a464eecf8d/README.md","https://github.com/allenai/olmocr/blob/f7cfe4c22098b154c76b6ec950d1c0a464eecf8d/LICENSE"],"status":"UNPROVEN"}],"observed_at":"2026-07-25T06:49:03Z","protected_boundary":{"classification":"PUBLIC_CLEAN","excluded_classes":["secrets","credentials","private keys","MFA or recovery codes","PHI","raw financial, legal, tax, insurance, mortgage, estate, brokerage, or account evidence","private network values","raw exports","personal chat archives","unredacted logs","executable payloads","source-heavy copyrighted material"]},"record_id":"HARVEST-OLMOCR-R01","schema_version":"atlas.ciel.harvest-record.v1","source":{"kind":"REPOSITORY","license_status":"VERIFIED","locator":"https://github.com/allenai/olmocr","retrieved_at":"2026-07-25T06:49:03Z","revision":"f7cfe4c22098b154c76b6ec950d1c0a464eecf8d"},"source_class":"PUBLIC_CLEAN","status":"REVIEWED","title":"olmOCR","verification":{"evidence_refs":["https://github.com/allenai/olmocr/blob/f7cfe4c22098b154c76b6ec950d1c0a464eecf8d/README.md","https://github.com/allenai/olmocr/blob/f7cfe4c22098b154c76b6ec950d1c0a464eecf8d/LICENSE"],"state":"PARTIAL","unresolved":["Runtime behavior, security effectiveness, performance, and compatibility were not independently executed or benchmarked in this Mission."]}}
