{"atlas_fit":{"affected_components":["Operation Ciel","Gluttony","AI Governance","Ares"],"current_problem":"Atlas needs a safe way to discover reusable agent skills without trusting registry popularity or loading unreviewed instructions.","future_risk":"Skill metadata and bundled files can manipulate discovery, selection, permissions, and tool execution.","recommendation":"ABSORB_CANDIDATE"},"claims":[{"claim":"Public skill ecosystems provide reusable instruction packages and source-grounded examples across many domains.","evidence_refs":["https://github.com/anthropics/skills","https://github.com/VoltAgent/awesome-agent-skills","https://github.com/JayLZhou/Awesome-Agent-Skills","https://github.com/openclaw/clawhub/blob/main/docs/skill-format.md","https://arxiv.org/abs/2605.11418","https://arxiv.org/abs/2606.01494"],"status":"VERIFIED"},{"claim":"Registry rankings or a single scanner are sufficient evidence that a skill is safe.","evidence_refs":["https://github.com/anthropics/skills","https://github.com/VoltAgent/awesome-agent-skills","https://github.com/JayLZhou/Awesome-Agent-Skills","https://github.com/openclaw/clawhub/blob/main/docs/skill-format.md","https://arxiv.org/abs/2605.11418","https://arxiv.org/abs/2606.01494"],"status":"REJECTED"}],"observed_at":"2026-07-25T06:49:03Z","protected_boundary":{"classification":"PUBLIC_CLEAN","excluded_classes":["secrets","credentials","private keys","MFA or recovery codes","PHI","raw financial, legal, tax, insurance, mortgage, estate, brokerage, or account evidence","private network values","raw exports","personal chat archives","unredacted logs","executable payloads","source-heavy copyrighted material"]},"record_id":"HARVEST-AGENT-SKILL-REPOSITORY-SURVEY-R01","schema_version":"atlas.ciel.harvest-record.v1","source":{"kind":"OTHER","license_status":"NOT_APPLICABLE","locator":"mission://CIEL-C01-M02/source-set/agent-skill-repository-survey","retrieved_at":"2026-07-25T06:49:03Z","revision":"fc13fa584f9225895851e8146c2c2f9162c001aafa12afa9e9ad515ab129f6ec"},"source_class":"PUBLIC_CLEAN","status":"REVIEWED","title":"Agent Skill Repository Survey","verification":{"evidence_refs":["https://github.com/anthropics/skills","https://github.com/VoltAgent/awesome-agent-skills","https://github.com/JayLZhou/Awesome-Agent-Skills","https://github.com/openclaw/clawhub/blob/main/docs/skill-format.md","https://arxiv.org/abs/2605.11418","https://arxiv.org/abs/2606.01494"],"state":"PARTIAL","unresolved":["Runtime behavior, security effectiveness, performance, and compatibility were not independently executed or benchmarked in this Mission.","Composite source-set claims depend on the cited official pages and require re-Harvest when those pages or terms change."]}}
