{"atlas_fit":{"affected_components":["Operation Coppermind","Archive/Index","Operation Ciel"],"current_problem":"Atlas needs local retrieval that connects Markdown facts across files while preserving source identity and freshness.","future_risk":"LLM-extracted graph edges and embeddings may create false relationships or silently drift after model changes.","recommendation":"ABSORB_CANDIDATE"},"claims":[{"claim":"The repository documents a local Markdown Graph RAG system with wikilink/frontmatter parsing, hybrid retrieval, incremental updates, Ollama processing, and storage-integrity checks.","evidence_refs":["https://github.com/benmaster82/Kwipu/blob/908f0e4e300578a22c5fadd4538f75ff7ccfc0b6/README.md","https://github.com/benmaster82/Kwipu/blob/908f0e4e300578a22c5fadd4538f75ff7ccfc0b6/LICENSE"],"status":"VERIFIED"},{"claim":"Its extracted graph and anti-hallucination prompt make every answer factually reliable.","evidence_refs":["https://github.com/benmaster82/Kwipu/blob/908f0e4e300578a22c5fadd4538f75ff7ccfc0b6/README.md","https://github.com/benmaster82/Kwipu/blob/908f0e4e300578a22c5fadd4538f75ff7ccfc0b6/LICENSE"],"status":"UNPROVEN"}],"observed_at":"2026-07-25T06:49:03Z","protected_boundary":{"classification":"PUBLIC_CLEAN","excluded_classes":["secrets","credentials","private keys","MFA or recovery codes","PHI","raw financial, legal, tax, insurance, mortgage, estate, brokerage, or account evidence","private network values","raw exports","personal chat archives","unredacted logs","executable payloads","source-heavy copyrighted material"]},"record_id":"HARVEST-KWIPU-R01","schema_version":"atlas.ciel.harvest-record.v1","source":{"kind":"REPOSITORY","license_status":"VERIFIED","locator":"https://github.com/benmaster82/Kwipu","retrieved_at":"2026-07-25T06:49:03Z","revision":"908f0e4e300578a22c5fadd4538f75ff7ccfc0b6"},"source_class":"PUBLIC_CLEAN","status":"REVIEWED","title":"Kwipu","verification":{"evidence_refs":["https://github.com/benmaster82/Kwipu/blob/908f0e4e300578a22c5fadd4538f75ff7ccfc0b6/README.md","https://github.com/benmaster82/Kwipu/blob/908f0e4e300578a22c5fadd4538f75ff7ccfc0b6/LICENSE"],"state":"PARTIAL","unresolved":["Runtime behavior, security effectiveness, performance, and compatibility were not independently executed or benchmarked in this Mission."]}}
